{
  "schemaVersion": 1,
  "name": "Rust Server Control Center verified catalog",
  "updatedUtc": "2026-10-04T00:00:57Z",
  "plugins": [
    {
      "id": "rust-rates",
      "name": "Rust Rates",
      "description": "Multiplicateurs de récolte, fabrication, fonte et ressources, configurables depuis le Control Center.",
      "version": "1.0.0",
      "author": "Rust Server Control Center",
      "category": "Administration",
      "framework": "Carbon",
      "fileName": "RustRates.cs",
      "downloadUrl": "",
      "sha256": "a2030385d9c9b0d2ef91e1d1731e58b1990cbed09113eda2edf1d2348d490b26",
      "dependencies": [],
      "homepage": "",
      "bundledPath": "catalog/bundled/RustRates.cs",
      "bundledManifestPath": "sdk/manifests/RustRates.json",
      "manifestSha256": "7eb3752254a49de0c8e4ce4ecf590ace7bd3b5bfccccdc7f991ad6594eac4a37"
    },
    {
      "id": "rust-game-hub",
      "name": "Lobby & modes compétitifs",
      "description": "Lobby central, capture du drapeau, domination, Search & Destroy et extraction.",
      "version": "2.3.0",
      "author": "Rust Server Control Center",
      "category": "Gameplay",
      "framework": "Carbon",
      "fileName": "RustGameHub.cs",
      "downloadUrl": "",
      "sha256": "52dd5ba042e7957f8367e4c5a595a6eb57a1ab67067f3c940e975af0e5546c91",
      "dependencies": [],
      "homepage": "",
      "bundledPath": "catalog/bundled/RustGameHub.cs",
      "bundledManifestPath": "sdk/manifests/RustGameHub.json",
      "manifestSha256": "81736a9d0d34bbd16891d7fe01eede32cf1a23027bc8d904d47fa3ec86c93896"
    },
    {
      "id": "rust-gun-game",
      "name": "Gun Game",
      "description": "Gun Game façon Counter-Strike avec arène aléatoire, progression par élimination et munitions gérées par le mode.",
      "version": "3.3.0",
      "author": "Rust Server Control Center",
      "category": "Gameplay",
      "framework": "Carbon",
      "fileName": "RustGunGame.cs",
      "downloadUrl": "",
      "sha256": "3361a17b436611a34ed5d5b6d2bbd29c3d923fa966ebd975686ea207c22ffa01",
      "dependencies": [],
      "homepage": "",
      "bundledPath": "catalog/bundled/RustGunGame.cs",
      "bundledManifestPath": "sdk/manifests/RustGunGame.json",
      "manifestSha256": "67f1a3e47c8293ef2b31f61507fbb8f5f95c569cb4ad26e9c29a012b57b51177"
    },
    {
      "id": "rust-duel",
      "name": "Duels & tournois",
      "description": "Files 1v1 à 4v4, kits, spectateurs, classement ELO et tournois.",
      "version": "2.2.2",
      "author": "Rust Server Control Center",
      "category": "Gameplay",
      "framework": "Carbon",
      "fileName": "RustDuel.cs",
      "downloadUrl": "",
      "sha256": "1890ebb0daed0d4a305454e53c95470e67006fc3ef3f5b5d2d7f34db86515335",
      "dependencies": [],
      "homepage": "",
      "bundledPath": "catalog/bundled/RustDuel.cs",
      "bundledManifestPath": "sdk/manifests/RustDuel.json",
      "manifestSha256": "a66322fa732c46c838c2cf45a26110cde00d1588df2e7570d88dea65c376ac3c"
    },
    {
      "id": "rust-zombie-progression",
      "name": "Zombies & progression",
      "description": "Vagues de zombies, ennemis spéciaux, boss, boutique, compétences, économie et mode endless.",
      "version": "4.1.0",
      "author": "Rust Server Control Center",
      "category": "Gameplay",
      "framework": "Carbon",
      "fileName": "RustRPG.cs",
      "downloadUrl": "",
      "sha256": "189620a0c11c0975e8a3ed075fcee70c2d71697526ec6cebb3efe290b69e2dcc",
      "dependencies": [],
      "homepage": "",
      "bundledPath": "catalog/bundled/RustRPG.cs",
      "bundledManifestPath": "sdk/manifests/RustRPG.json",
      "manifestSha256": "f7353345e86fd9ec75037441caa10ddda6e1ddf9404e2a6aba0ced7f7346cd77"
    },
    {
      "id": "rust-tower-defense",
      "name": "Tower Defense",
      "description": "Défense coopérative constructible avec routes fixes, vagues, boutique, améliorations et mode endless.",
      "version": "1.1.0",
      "author": "Rust Server Control Center",
      "category": "Gameplay",
      "framework": "Carbon",
      "fileName": "RustTowerDefense.cs",
      "downloadUrl": "",
      "sha256": "6cd368d4a429da191f3bb6299b99ad0b202ee312bdf5c05482cecdf640c34784",
      "dependencies": [],
      "homepage": "",
      "bundledPath": "catalog/bundled/RustTowerDefense.cs",
      "bundledManifestPath": "sdk/manifests/RustTowerDefense.json",
      "manifestSha256": "6d99bf73322f8595b0c7b42277fea3667a82b44df268bd0e2880c8f5159d81f1"
    },
    {
      "id": "rust-training",
      "name": "Entraînement",
      "description": "Stand de tir, cibles mobiles, suivi de précision et sparring à l’arme blanche.",
      "version": "2.0.0",
      "author": "Rust Server Control Center",
      "category": "Gameplay",
      "framework": "Carbon",
      "fileName": "RustTraining.cs",
      "downloadUrl": "",
      "sha256": "b4a4a85d363d0a5fbe1d2f3ceb8709f1401fab5f3064d158de083c43a2106080",
      "dependencies": [],
      "homepage": "",
      "bundledPath": "catalog/bundled/RustTraining.cs",
      "bundledManifestPath": "sdk/manifests/RustTraining.json",
      "manifestSha256": "827edcafa367b3093504604d33b61bc3fbe365c7aa786f888055e0c307ef8b50"
    },
    {
      "id": "rust-stats",
      "name": "Statistiques des modes",
      "description": "Agrège les résultats des modes installés et expose classements, records et fiches joueur au dashboard.",
      "version": "1.0.0",
      "author": "Rust Server Control Center",
      "category": "Utilitaire",
      "framework": "Carbon",
      "fileName": "RustStats.cs",
      "downloadUrl": "",
      "sha256": "8246305d8decc87d7cbd9cb7c08ac7deeacd3fb97f1bc729f9330ddc6bbe96eb",
      "dependencies": [],
      "homepage": "",
      "bundledPath": "catalog/bundled/RustStats.cs",
      "bundledManifestPath": "sdk/manifests/RustStats.json",
      "manifestSha256": "5fbaccc116291eb0e96f80d5676f267847fa35670ab9740ba3c995f171207971"
    }
  ]
}
